{"error_count":0,"errors":[],"lint_task":"mix orbital_dynamics.campaign.lint --type repair --request PATH","request":{"path":"studies/leo_constellation_campaign_repair_v2.json","sha256":"c7e6d90887110223599de6d5bff1757363c3e5e361cebc806ed83f6abf339341"},"schema_contract":"campaign_request_lint.v1","semantic_validator":"OrbitalDynamics.CampaignPlanner.request_validation_report/3","source_plan":{"artifact_key":"campaign_plan","path":"/Users/donovanrost/projects/ex-orbital-dynamics/study_results/leo_constellation_campaign.json","plan_id":"campaign_plan:leo_constellation_campaign:2026-05-14T00:00:00Z","requested_path":"study_results/leo_constellation_campaign.json","schema_contract":"campaign_plan.v1","sha256":"5f3c7463c6effe821d3f8a62031dcde9924f69991bfd4eff0936461797b02003","source":"source_plan_ref","status":"pass"},"status":"pass","type":"repair","validation_mode":"campaign_request_lint"}
